{
  "schema_version": "1.0.0",
  "record_id": "com.openai.codex",
  "bundle_identifier": "com.openai.codex",
  "application_name": "Codex",
  "application_version": "3593",
  "execution_tier": "native-substitution",
  "compatibility_state": "verified",
  "last_updated": "2026-06-06T15:25:00Z",
  "tested_on": [
    {
      "distribution": "Ubuntu",
      "version": "24.04",
      "kernel_version": "6.8.0",
      "arch": "x86_64"
    }
  ],
  "known_issues": [],
  "workarounds": [],
  "required_flags": {},
  "tags": ["electron", "ai-tool", "editor"],
  "notes": "Runs natively via Electron runtime substitution (Tier 0) using dynamic database tier overrides."
}
